{
  "metadata": {
    "repo_name": "Small Microservice",
    "repo_url": "https://github.com/example/small-service",
    "branch": "main",
    "commit_hash": "3e4f5a6b",
    "commit_date": "2025-12-04T08:15:00-05:00",
    "last_scan": "2025-12-04T10:00:00-05:00",
    "scan_duration_seconds": 3.2,
    "scanner_version": "CORTEX-3.5.5"
  },
  "health": {
    "overall_score": 92,
    "trend": "stable",
    "status": "healthy"
  },
  "code_metrics": {
    "lines_of_code": 2500,
    "file_count": 45,
    "directory_count": 12,
    "language_breakdown": {
      "Python": 2000,
      "YAML": 300,
      "Markdown": 200
    }
  },
  "code_quality": {
    "complexity_score": 88,
    "maintainability_index": 85,
    "cyclomatic_complexity_avg": 4.2,
    "cognitive_complexity_avg": 3.1,
    "code_duplication_pct": 1.8,
    "comment_ratio_pct": 22.5
  },
  "testing": {
    "coverage_pct": 85.3,
    "unit_test_count": 68,
    "integration_test_count": 22,
    "test_pass_rate_pct": 100.0
  },
  "issues": {
    "total_count": 3,
    "by_severity": {
      "critical": 0,
      "high": 0,
      "medium": 2,
      "low": 1
    },
    "technical_debt_days": 0.5,
    "code_smells_count": 4
  },
  "dependencies": {
    "total": 28,
    "direct": 12,
    "transitive": 16,
    "outdated": 1,
    "vulnerable": 0,
    "health_score": 98
  },
  "security": {
    "score": 98,
    "vulnerabilities": {
      "critical": 0,
      "high": 0,
      "medium": 0,
      "low": 0
    },
    "secrets_exposed": 0,
    "last_scan": "2025-12-04T09:30:00-05:00"
  },
  "performance": {
    "build_time_seconds": 8.5,
    "test_execution_time_seconds": 4.2,
    "deployment_frequency": "daily",
    "mean_time_to_recovery_hours": 0.5
  },
  "activity": {
    "commits_last_30_days": 42,
    "contributors_active": 2,
    "pull_requests_open": 1,
    "pull_requests_merged_last_30_days": 12
  },
  "custom_metrics": {
    "mock_data": true,
    "scenario": "healthy",
    "repo_size": "small",
    "microservice": true,
    "api_endpoints": 8
  }
}
